{
  "event_id": "evt_demo",
  "name": "National Cup Final",
  "venue_entity_id": "stadium_main",
  "expected_attendance": 70000,
  "start_time": "2026-09-04T16:00:00Z",
  "end_time": "2026-09-04T18:30:00Z",
  "sim_time": "2026-09-04T15:20:00Z",
  "concurrent_events": [
    {
      "event_id": "evt_expo",
      "name": "Tech Expo Day 2",
      "category": "conference",
      "venue_entity_id": "convention_centre",
      "start_time": "2026-09-04T12:00:00Z",
      "end_time": "2026-09-04T17:00:00Z",
      "original_start_time": "2026-09-04T12:00:00Z",
      "original_end_time": "2026-09-04T17:00:00Z",
      "expected_attendance": 14000,
      "out_of_town_share": 0.4,
      "lodging_share": 0.136,
      "lodging_share_effective": 0.136,
      "lodging_share_source": "event",
      "lodging_guests": 1904,
      "local_guests": 12096,
      "lodging_allocated_guests": 1904,
      "lodging_unmet_guests": 0,
      "venue_name": "City Convention Centre",
      "status": "live",
      "delay_sec": 0,
      "arrived": 14000,
      "inside": 14000,
      "description": null,
      "remaining_demand": 0,
      "custom_windows": false,
      "arrival_window_start": "2026-09-04T10:24:00Z",
      "arrival_window_end": "2026-09-04T12:16:00Z",
      "departure_window_start": "2026-09-04T16:55:00Z",
      "departure_window_end": "2026-09-04T17:35:00Z"
    },
    {
      "event_id": "evt_fanfest",
      "name": "Fan Festival",
      "category": "festival",
      "venue_entity_id": "zone_fanpark",
      "start_time": "2026-09-04T15:00:00Z",
      "end_time": "2026-09-04T19:30:00Z",
      "original_start_time": "2026-09-04T15:00:00Z",
      "original_end_time": "2026-09-04T19:30:00Z",
      "expected_attendance": 5500,
      "out_of_town_share": 0.1,
      "lodging_share": 0.034,
      "lodging_share_effective": 0.034,
      "lodging_share_source": "event",
      "lodging_guests": 187,
      "local_guests": 5313,
      "lodging_allocated_guests": 186,
      "lodging_unmet_guests": 0,
      "venue_name": "Fan Park",
      "status": "live",
      "delay_sec": 0,
      "arrived": 5412,
      "inside": 5412,
      "description": null,
      "remaining_demand": 88,
      "custom_windows": false,
      "arrival_window_start": "2026-09-04T13:24:00Z",
      "arrival_window_end": "2026-09-04T15:16:00Z",
      "departure_window_start": "2026-09-04T19:25:00Z",
      "departure_window_end": "2026-09-04T20:05:00Z"
    }
  ]
}
